date,review,rating
24.06.13.,2년전에 구매했다가 잃어버려서 다른거 쓸까 찾다가 결국 모슈에서 다시 재구매했어요. 사용했을때 불편함을 느꼈던 빨대와 밑면 부분이 개선되어 더 마음에 듭니다! 가벼워서 휴대용으로 쓰기 너무 편해요!,5
24.06.05.,"디자인 색상 다 맘에 들어요
다 좋은데 뚜껑 실리콘이
살짝 찢어져있네요
큰 문제는 아닌거 같아서 그냥 쓰는데
검수가 잘 됐으면 더 좋았을거같네요",4
24.07.06.,차가운건 보냉이 오래가는거 같은데 따뜻한 음료는 지속력이 쪼끔 떨어진거 같아요.,4
24.06.12.,빨대 좋아요! 살짝 걱정했는데 성능 좋아요. 다만 오래 사용하면 작은 틈 청소하는 게 좀 힘들것 같아요. 하지만 디자인도 예쁘구요. 다른색상 사서 선물하고 싶은 마음이에요.,5
24.06.30.,너무 잘 사용중이에요. 흔하지도 않고 밀봉도 되고 좋아요.,5
24.06.06.,"스트로우 뚜껑 사진처럼 안에 넣고 텀블러 뚜껑으로 눌러주면 따로 보관할 필요없어요!!

저번에 화이트 구매하고 또 필요해서 이번엔 아이보리로 구매했어요! 뚜껑 닫으면 한방울도 안 흘려서 너무 좋아요ㅎㅎ

++ 이렇게 가지고 다니다가 어디에서 잃어버렸는지도 모르게 사라졌슴당,,,,ㅎㅎㅎ헿ㅎㅎ
다행히 이번이 재구매라 스트로우 뚜껑 1개 남아서 그걸루 번갈아끼우면서 사용 중인데 뚜껑도 따로 팔아주세여ㅠㅠㅠ 흑ㅜㅜ
지금은 사용할 때 따로 지갑에 보관 중이에요><",5
24.07.09.,식세기 사용이 안되니 씻기 불편해요,4
24.07.08.,"아이보리랑 고민했는데 생각이상 너무이뻐용
실리콘빨대도 편합니다! 
스탠리보단 보냉기능은 살짝 아쉽지만
그래도 하루 쓰는데 불편함은 전혀 없어요",5
24.07.25.,색깔이 맘에 들고 얼음이 빨리안녹아서 좋아요~,5
24.07.30.,선물했는데 마음에 들어합니다.,5
24.07.27.,디자인 예뻐서 마음에들어요,5
24.07.01.,너무 이뻐요 텀블러갸 있는데 또 사버림 ㅎㅎ,5
24.06.22.,"일단 귀엽고 빨대가 있어서 좋았지만 코딩되어 있다고 하더라도 실리콘이라 어쩔 수 없이 먼지가 좀 붙는 것 같습니다
 그리고 물을 입으로 마시면 실리콘에 코가 닿고 입구에 물이 고여서 여닫는 부분 홈으로 고인 물이 흘러나옵니다",4
24.07.07.,보온 보냉 너무 잘되네요,5
24.06.25.,4번째 구매인듯. 쓰기편하고 선물용으로도 좋아요,5
24.06.27.,"색도 마음에 들고 텀블러가 귀엽네요
잘 사용할게요",5
24.06.07.,진짜 밀폐 잘 되고 빨대도 생각보다 불편하지 않았어요! 손이 쑥 들어가서 세척도 쉽고 무엇보다 바닥에 실리콘 덧대져 있는 게 너무 좋습니다 테이블에 놓을 때마다 듣기 싫은 소리가 안 나요 ㅠㅠ 비싸지만 만족도 높게 오래 쓸 수 있을 것 같아요!,5
24.06.25.,"보냉이 오래 잘 돼서 정말 좋고, 카페음료 기본사이즈는 무난히 테이크아웃 가능해서 잘 쓰고 있습니다.",5
24.07.05.,얼음도 잘 안녹고 색도 이쁘고 좋아요^^,5
24.07.24.,"하나 더 사고싶어요
소장가치 충분",5
24.06.11.,생각보다 가볍고 생각대로의 크기에요. 색감은 기대보다 이뻐요.. 화이트랑 한참 고민하다 샀는데 제 핸폰 색감이랑 비슷해서 완전 만족해요,5
24.07.01.,"외관도 이쁘고 기능도 다양해서 좋아요!
우선 밀폐력이 좋아요ㅎㅎ가방에 넣고다니면 전혀 새는게없네요 그래서 이동성 굿굿입니다",5
24.06.19.,귀여워요 무게감도 가벼운편이고요 세척도 빨대도 실용적입니다 짱,5
24.07.16.,예쁘고 좋아요 보온보냉 확실,5
24.06.22.,매일 매일 사용하고 있어요 빨대도 일회용 필요없어서 더 좋아요,5
24.07.03.,편하고 디자인도 이뻐요^^,5
24.06.16.,얼음도 잘 안 녹고 밀폐력도 갑이에요! 다만 사이즈 선택 미스로 좀 아쉽긴 하지만 나중에 더 큰 사이즈로 하나 더 구매하면 되져~,5
24.04.17.,"왼쪽 빨간 모슈 텀블러를 샀었는데 얼음이 안 들어가서 걷기할 때 물통으로만 사용중입니다. 보라색 스타벅스 스탠리 텀블러는 따로 세척솔 사용 안 하고 제 손 쑥하고 넣어서 세척 가능하고 스탠리 제품이라 얼음 녹는 속도도 느려서 잘 사용했는데 단점이 있더라구요. 커피 샐까봐 흔들리는 대중교통을 못 탄다는 것..ㅜㅜ 주로 집이랑 동네에서만 사용 중. 

어떤 텀블러를 살까 고민 중이었는데요. 제가 모슈 텀블러 사면서 받은 빨대를 정말 잘 사용하고 있거든요. 먼지 안 붙고 세척 용이!!! 그래서 모슈 제품 중 다른 텀블러를 찾다가 라떼 텀블러라는 이 제품을 발견했습니다. 얼음 잘 들어가고 커피 샐 걱정은 안 해도 돨 거 같고 크기는 스타벅스 톨 사이즈랑 모슈 그란데 사이즈랑 다행히 크게 차이 안 나더라구요. 봄가을겨울은 톨 사이즈가 좋은데 아무래도 여름에는 그란데가 편하고 근데.... 또 그란데 사이즈가 너무 크면 들고 다니기 불편하고 고민이었는데 집에서 자로 재어보니까 뚜껑 때문에 1cm 좀 더 큰 크기라 이걸로 샀구요. 배송도 엄청 빠르고 만족합니다. 제 손도 잘 들어가서 세척도 편할 거 같습니다. (여성 치고도 작은 손)

진짜 이뻐요. 모슈 레드 텀블러, 화이트 라떼 텀블러, 옐로우 도시락통(김밥 답기 좋음), 멜론 색상 죽통..ㅎㅎ 집에 있는 모슈 제품 다 마음에 듭니다. 컬러가 진짜 좋음... 이뻐서 사면 진짜 오래오래써요.",5
24.06.13.,초등 딸아이가 좋아해요 6학년이라서 어린이같은 물병은 싫다해서 구입했는데....제가 더 맘에 들어요,5
24.07.08.,이뻐요  빨때도 들고다닐수있는게좋네요 세척도 편리하구,5
24.07.02.,밀폐잘되고 좋아요!!,5
24.06.11.,출산하고 병원에서부터 조리원까지 너무너무 잘썼어요! 빨대가 신의 한수고 남편이 조리원 준비물 중에 제일 잘 산거 같다규 하네오,5
24.06.09.,"아직 사용전이라 보온보냉 기능은 잘 모르겠지만 용량대비 가벼운 편인거 같아요ㅎ
빨대 외경이 10mm인건 안들어가는거 같아요(스탠리 591 빨대), 
세트로 나온 실리콘 빨대나 좀 더 얇은 빨대를 사용하면 될거 같습니다",5
24.07.06.,이쁘고 독특해서 선물로 주기 좋은 텀블러에용 ㅋㅋㅋ 앞으로도 잘 만들어주세요! 근데 초록색는 안나오나요?,5
24.06.18.,디자인이 마음에 들고 빨대의 기능성이 좋았습니다. 세척할때 특히 편하네요.,5
24.07.13.,예쁘고 좋아요. 용량이 커서 그런지...완전 커요 ㅋㅋㅋ,5
24.05.28.,"한달 이상 쓰고 느낀점 추가하자면
다른 분들이 말씀 하신것처럼 내용물이 입 대는 부분에 고이긴 하는데, 물 먹을땐 신경 안쓰이는데 커피같은 색 음료 마실땐 지저분해 보이고 신경 쓰인긴 합니다.

그리고 꼭 잘 씻고 잘 말리세요!! 까딱하다간 입 대는 쪽에서 물 비린내(?) 날 수 있을 것 같아요

무게는 아주 가볍고 잘 들고 다니고 있습니다",5
24.06.26.,예뿌고 조앙요 ㅎㅎ 물도 잘 안 새요 ㅎㅎ,5
24.05.11.,"다들 모슈모슈해요.. 완전 밀폐되고 뚜껑 오픈도 편해보여서 비싸지만 큰멈 먹고 구매!!
빨대는 제가 잘 사용 안해서 보관만 하고 있고요. 
뚜껑에 달린 실리콘이 굉장히 대박이네요!!
차에서 텀블러 들때 다른 텀블러들은 들어올리기 좀 힘들었는데 요건 뚜껑이 똭 잡혀 손쉽게 들어져요!!
다만 아쉬운 점은… 기스가 너무 잘나요ㅠㅠ
얼마 사용 안했는데 여기 저기 긁히고 페인트 벗겨져서 너무 보기 흉해서 스티커 붙였어요 ㅠㅠ
코팅력이 너무 약하네??
그리고 따뜻한 물이 오래 가지는 않아요..
주둥이 넓어서 그런가~",5
24.06.18.,"뜨거운물은 생각보다 오래 가진 않네요 ㅠㅠ
그치만 이뻐서 조어요!",5
24.06.29.,핑크색 너무 예뻐요! 입구가 넓어서 세척하기 좋습니다. 조금 무겁긴 해요.,5
24.06.18.,사용하기도 편하고 단열력 좋아서 선물할때 또 구매하겠습니다,4
24.06.21.,사진이 실물보다 하얗게 나왔는데 이뻐요,5
24.06.17.,"너무 귀엽고 보온보냉 짱입니다,,,, 무조건 사세요!!",5
24.07.04.,생일선물로  구매했어요  받는사람이 직접골랐어요  감사합니다,5
24.06.19.,"너무 예뻐요 생긴것보다 더 많이 들어가고, 휴대성 갑이네요",5
24.06.18.,스트로도 씻고 사용할수있고 물이 안샌다니 좋네요,5
24.07.10.,"동생 생일선물!
역시 예쁘고 빨대까지 잇어서 좋아요",5
24.06.12.,카페에 제 모슈 텀블러를 두고다녔는데 사장님이 괜찮아보인다고 하셔서 하나 선물해드렸어요 제가 가진 텀블러보다 훨씬 더 귀엽고 예뻐요 왕 예쁜 색이고 텀블러 사실 분들에게 왕추천합니다,5
24.06.11.,큰거 사서 들고다냤는데 쬐끔 무거워서 요걸로 재구입했어요 딱 좋아요,5
24.06.12.,빨대 세척도 편리하고 보관도 용이하고 디자인도 이쁘고 떨어뜨렸을때도 실리콘이 있어 좋아요 굿굿,5
24.07.12.,사이즈  색상 기능성 너무너무  좋아요.,5
24.05.30.,"밀폐력이 최우선 조건이었는데 잘되구 디자인도 이쁘고 보냉도 엄청나진 않아도 적당히 잘 되는거 같아요
다만 사진처럼 마감이 조금 아쉬워요",5
24.07.11.,추천받아서 구매했는데 이쁘네요!,5
24.06.20.,사이즈 딱 좋고 넘 잘쓰고 있어요,5
24.07.06.,350사용하소 맘에 들어서 한치수 더 큰거 구입해요 ㅋ,5
24.06.16.,"너무 만족입니다
싸고 좋아요",5
24.07.11.,너무 편하게 잘 쓰고있어요,5
24.06.20.,색깔 별로 다 모으고 싶어요.,5
24.06.20.,색깔 별로 다 모으고 싶어요.,5
24.06.20.,색깔 별로 다 모으고 싶어요.,5
24.05.26.,"물이 안새고 디자인도 깔끔해서 좋으나
보온력이 약한거 같아요.
뜨거운 물을 붓고 오래가지 못하더라구요.

얼음은 아직 안써봐서 모르겠지만 밀폐력은 최고예요",4
24.05.21.,"제가 써보고 좋아서,,
선물했는데 역시나 엄청 좋아합니다!!
사세요 사세요!!
정말 예쁘고 실용적이고 다 해버립니다
강추강추!!! 쟁여두고싶을만큼 넘 좋아요
350? 470? 둘다 넘 좋아요",5
24.07.12.,와 정말 좋습니다????????,5
24.06.07.,디자인이 예쁘고 빨대가 있어 편리해요,5
24.06.05.,"커피도 안새는데 텀블러도 귀여워서 너무 좋아요
하나 더 큰사이즈 구매해서 잘쓰다가 이번에 작은사이즈로 더 구매했어요",5
24.05.29.,친구 생일선물로 사줬는데 너무 좋아하네요! 색깔도 이쁘고 세척도 편리하대요??,5
24.06.15.,친구에게 선물해줬는데 정말 잘쓰고 있데요!!,5
24.06.09.,사용해보니  이뿌고  좋아요  감사합니다,5
24.05.28.,이쁜 거 사야 또 돈 안 쓰고 오래오래 씁니다. 엄마도 하나 사달래요. ㅎㅎ 요새는 이쁜데 상품도 질이 좋은 게 많아서 좋네요.,5
24.07.07.,"700ml 라서 정말 크네요
빨대 정말 좋아요^^",5
24.05.14.,"여름에 텀블러 고민하다가 가방에 넣어 다닐 수 있게 새지 않으면서도 빨대가 편하게 사용가능한 텀블러를 찾다가 모슈로 구매했는데 완전 만족합니다!???? 색도 버터 색으로 너무 귀엽고, 뚜껑 닫으면 새지도 않아서 찾던 텀블러 그 자체예요ㅠㅠ",5
24.05.22.,완전 밀폐되면서 스트로우 사용할 수 있는 텀블러 찾고있었는데 너무 마음에 들어요 !!! 색상도 시원해서 여름에 잘 쓸 것 같네요 ??,5
24.06.08.,요즘유행팀 스탠* 살까 한참고민 하다가 모슈로 샀어요 물새지 않게 가방에 넣을수 있는게 최고 장점인듯하고 가벼워서 좋아요^^ 디자인도 예뻐요,5
24.07.07.,"보온보냉이 조금 아쉽습니다,,",4
24.06.04.,"안새고 좋아요
스트로우 있는것도 너무 좋아요",5
24.06.09.,친구한테 선물해줬는데 너무 잘쓴다고 좋대요,5
24.06.01.,보냉력 여전하고 이쁨도 여전하네요. 아주 맘에 들어요,5
24.05.27.,잘 사용하는 제품이라 주변에 여럿 선물했어요. 서이즈가 적당하고 마감이 좋아서 자주 손이 가는 텀블러 입니다.,5
24.07.02.,귀여워서 선물하기 좋습니다.,5
24.06.12.,"만족합니다
만족합니딘",3
24.06.29.,"넘 이뻐요
다만 뚜껑 실리콘에 때 끼듯이ㅠㅠ",5
24.05.29.,가볍고 산뜻한 컬러감이 마음에 듭니다.,5
24.06.19.,"보냉, 보온도 잘되어서 흡족하다고 하네요~ 선물로도 안성 맞춤!! :) 추천합니다~!! :)",5
24.05.03.,"너~~무 예뻐요
요즘 좋다는 텀블러 다 사보는 중인데 스탠리는 좋긴해도 둘레가 뚱뚱하고 무거워서 들고다니기엔 짐스러운데 요건 얄쌍하니 집에서 컵 대용으로 쓰기도 좋네요~색도 깔끔하고 튼튼해보이고 아이디어 빨대까지!!! 모슈는 아이 이유식용으로도 잘썼어서 기대되요~",5
24.05.30.,너무 가벼워서 그런가 살짝만 건드려도 넘어지려고해요.. 그치만 이뻐서 다 이김,5
24.06.19.,잘쓰고있어요~~!~!~!,5
24.05.23.,깔끔하고 디자인 적으로 뛰어나요~ 밀폐력도 좋고 무엇보다 스트로우가 위생적이고 세척하기 편해서 맘에 들어요.,5
24.05.25.,예쁘고 좋아요! 빨대도 세척하기 정말 편합니다!,5
24.05.30.,직접보지못해 색상 사이즈 바꾸느라 배송비가 들었지만 잘쓸것같아요,4
24.05.31.,700할까하다가 480했는데 갖고다니기 딱 좋아요 일단 이쁨 ????? ? ? ??,5
24.05.13.,디자인도 예쁘고 보온 보냉 모두 잘돼요 특히 얼음은 무슨 대여섯시간 후에도 안 녹아있어서 신기했네요.. 빨대 실리콘냄새가 약간 낯설긴 했는데 이정도면 만족이에요,5
24.06.07.,인기있는 브랜드 텀블러를 구매하려다 밀폐가 안되서 모슈텀블러를 구매했는데 너무 만족합니다! 일단 무게도 가벼운것 같고 밀폐도 잘됩니다~,5
24.06.02.,원래 사용하던건 오래 돼어서 버리고 새로 잘 사용중이에요,5
24.06.08.,물이 새지않아 정말 만족합니다. 칼라감이 좋고 안까지 손 넣어 씻기 너무 편합니다,5
24.06.09.,잘쓰고있어요 좋아요,5
24.05.29.,제품이 예쁘고 보냉효과도 탁월해요,5
24.05.26.,빨대가 약할 것 같았는데 짱짱하고 좋으네요~ㅎ 텀블러 너무 예쁘고 좋아요~ㅎㅎ,5
24.05.18.,색깔 정말 예뻐요. 입구도 커서 세척도 용이하고 빨대도 따로 챙기지 않아도되서 좋습니다. 다른색도 구매하고 싶어요.,5
24.05.22.,너무어무 예쁘네요 색깔도 넘 예뻐요 잘쓸게요!!!,5
24.05.22.,"디자인  굿
근데  빨대는 어떻게 세척해야하나요?

그냥 물로만  씻자니 찝찝",5
24.05.17.,"모든 텀블러를 용량대로 모슈에서만 구입해요.
디자인 이쁜것은 말할것도 없고 기능적으로 진짜 최고에요. 보온보냉 시간 긴  것은 말할 것도 없고 씻기 간편하고 밀폐도 손쉽게  잘 되어서 모슈만 사용하고 있습니다. 요 텀블러도 색깔이 쨍한게 너무 이뻐요!  잘 쓸게요~~",5
24.07.13.,예쁘고 좋아요 좋아요,5
24.05.22.,"귀엽고 보냉력이 조은 거 가타요!! 아침에 스벅에서 받아온 얼음이 저녁에도 있도라구요,,ㅋㅎ 짱????",5
24.04.19.,"조리원 들어갈때 가져갈라구 텀블러 구매했어용!
빨대도 필요하다 해서 딱이다 싶어서 구매했어요
빨대 세척도 편하고 튼튼해서 잘쓸거 같아요!",5
24.04.15.,"잘쓰고있어요~
디자인 자체로도 너무 예뻐요!
빨대없이 쓸때는 다른분들 후기처럼
코가 뚜껑 고무패킹에 닿아서
뚜껑닫았다가 마실때 코에 음료가 묻긴해서 아쉽지만
크기도 크고 입구넓은게 장점이고
무엇보다 세척이 너무 편리해서 좋습니다.
뚜껑안쪽 세척이 번거로운 제품을 쓰다가
세척 쉬운 제품을 쓰니 너무 행복해요ㅠ
텀블러 교체가 잦으면 종이컵 쓰는것보다 환경에 좋지않다고하는데 고무패킹 교체용도 따로 판매하니 오래쓸수있을거같아요.
가격이 비싸서 한개밖에 못샀지만
나중에 더 들여야겠어요^^",5
24.05.26.,디자인은 너무 이쁜데 뚜껑부분이 세척하기가 힘들어요….,4
24.05.16.,480이 적당하고 좋아요. 가득 채워도 별로 안 무겁고 가방 옆 주머니에 쏙 들어가는 사이즈입니다. 다만 떨어뜨리니 찌그러져서 그 부분은 살짝 아쉽습니다. 보온보냉 완벽하고 빨대도 편하게 세척할 수 있어 만족합니다,5
24.04.18.,700이라 그런지 무겁긴 한데 어디 놔두고 마시기에는 딱 좋네요!! 정수기 여러 번 왔다갔다 안 해도 돼서 좋습니당 ㅎㅎ 디자인도 너무 귀여워요 이게 최고 메리트... 나중에 들고 다닐 일 많아지면 작은 사이즈로 하나 더 사려고요 감사합니다,5
24.05.15.,"아침에 넣은 얼음이 사이즈만 작아지지 저녁까지도 얼음이 남아있어서 놀랐어여
가격대는 있지만 창 잘구입한것 같아여",5
24.06.10.,디자인보고샀는데 입구가넓어서 세척하기도좋고 얼음도오래가요,5
24.06.01.,얼음이 잘 안녹더라고요. 크기대비 무게감도 부담스럽지않고요. 만족해요.,5
24.05.19.,보온 보냉도 잘 되는것 같고 작아서 편하게 들고 다닐수 있을것 같아요,5
24.07.16.,shhshehs benjsksvs,5
24.05.23.,다 좋은데 위에 뚜껑열고 입으로 먹으면 뚜껑이 코에 닿네요 ㅎㅎ,4
24.06.08.,너무 디자인도 심플하고 예뻐요 갖고 다니기 좋아요~^^,5
24.06.06.,남자친구 선물로 줬는데 맘에 들어하고 선물용으로도 좋은거 같아요!,5
24.05.27.,들고다니면 너무 예빠요!!,5
24.06.05.,"감사합니다 잘사용하겠습니다 
너무좋아요",5
24.05.25.,너무 이뻐요 ㅋㅋㅋ. 조아요,5
24.05.21.,넘 예쁘네요 잘쓸게요,5
24.06.09.,역시 예상했던대로 넘 이뻐요,5
24.05.12.,디자인정말이쁘네요. 설거지할때 손들어감,5
24.05.23.,아기가 자꾸 물 찾아서 매번 깜빡했는데 여름이라 시원한물 챙겨다니기 좋네요 빨대도 있어서 아기가 좋아하네요,5
24.06.06.,친구 선물줳는ㄷ데 너무 좋아해서 좋았어오,5
24.05.05.,물 마시고 나서 입구 부분에 물이 고인 걸 안 닦아주면 물이 새어 있네요 ㅠㅠ 다음에 만들어주실 때는 물 마시고 나서 물이 고여있지 않게 설계해서 만들어주세요!,4
24.05.06.,"예쁘고 가벼워서 쓰기 좋아요
물 샐까 걱정했는데 안새네요",5
24.05.24.,"지금까지 써본 텀블러중에 최고입니다
밀폐력이 좋아서 싸들고 다니기에도 좋고 특히 빨대가 있어서 편리하네요 ㅎ",5
24.05.10.,사이즈 가장 큰걸로 주문했는데 별로 무겁지 않아요 디자인은 화이트가 가장 이쁜것 같아요,5
24.06.05.,"역시조아 
감사합니다 잘사용하겠습니다",5
24.06.08.,플라스틱 컵 안만들어서 뿌듯합니다,5
24.04.11.,"디자인도 이쁘고 빨대를 구부려서 휴대할 수 있다는게 제일 끌려서 구입했어요 
이쁘다는 장점이 제일 크고 보냉도 은근 오래가네요
근데 단점은 많은 분들이 썼던 것처럼 빨대를 쓸때마다 먼지를 닦아야 한다는 점.. 그리고 저는 빨대로 음료 늘 저어서 마시는 편인데 빨대 재질 특성상 저을수가 없네요 ㅠ 아쉬운점도 있지만 생각보다 가볍고 이뻐서 잘 쓸거같긴해요",4
24.06.13.,감사합니당 감사합니당,5
24.06.03.,선물했는데 다들 마음에 들어하네요,5
24.06.03.,선물했는데 다들 마음에 들어하네요,5
24.05.20.,재구매했어요 좋아요,5
24.05.15.,용량대비 가볍고 작은게 좋아요!,5
24.05.12.,크기가 적당하고 색감하고 똑같아서 좋아요!,5
24.04.16.,"이 디자인에 이 무게에 이 성능인데 만족하지 않을 수가 없어요ㅋㅋㅋ
제일 고려했던 점이 밀폐성인데 꽉 잘 닫으면 가방에 넣고 다녀도 정말 안 흐르더라구요!! 무게도 가볍습니다

입 대는 부분에 물이 좀 고인다는 단점은 리뷰들 보고 알고 샀는데, 의외로 신경 안쓰이네요",5
24.05.19.,쓰던 제품이고 성능은 최고입니다.  디자인 컬러 다 맘에 들어요~~,5
24.04.16.,"일단 귀엽고 예쁘네요 빨대를 열어서 씻을수있다는 점이 제일 마음에 들어요
크기는 제손에 480ml도 충분해요
이거보다 작으면 너무 자주 물떠야할거같고 큰건 손에 안잡히거나 무거울거같아요!",5
24.04.28.,"추천 받아서 삿어요! 너무 좋아요??
앗 아쉬운건 처음에 살짝 오염이 되어잇엇습니다...",5
24.06.03.,만족하며 잘 쓰고 있어요,5
24.06.03.,만족하며 잘 쓰고 있어요,5
24.06.02.,상품설명은 사이트에 자세히 적혀잇어요,5
24.06.02.,어제 넣어둔 얼음이 다음날 오후에도 있어요!,5
24.05.14.,동생이 아주 좋아해요,5
24.04.14.,첫배송엔 찍힘이있어서왔는데 빠른 교환으로 만족했습니다! 처음 포장이랑 두번째 배송포장이 너무 달라서 아쉬운 마음에 1점은 뺐습니다. 그외에는 디자인이나 기능면에서는 만족합니다!,4
24.03.28.,"받자마자 색이 생각보다 노란색 계열이라 당황했지만 막상 보다보니 매력있는 색이에요! 화면보다 좀 누리끼리한 느낌이에요. 화면이 더 밝게 나오는 듯!
열리는 빨대도 엄청 신기하구.. 설거지하기 완존 편해서 굿굿. 근데 빨대로 마실 때다 꼬로로롤 소리가 들리는데 이건 어쩔 수 없는 부분일까요..? 소리내며 마시는게 좀 아쉬운 부분이네요 ㅜ.ㅜ
가볍고 귀엽고 편리해서 많이 들고다닐듯해요!",5
24.05.10.,얼음 잘 안녹고 색깔이 너무 예뻐요,5
24.05.01.,밀폐도 잘되고 디자인도 예뻐서 진짜 만족해요 !!! 다른색상도 살까 고민중이에요 !,5
24.04.21.,선물했는데 색상도 쨍하니 예쁘고 사이즈도 좋아서 친구가 정말 마음에 들어했어요. 선물용으로도 아주 좋아요:),5
24.05.27.,"가벼워서 들고다니기 좋습니다! 
근데 고무줄이 빠졌네요 ㅠㅠ",5
24.03.29.,"노란색은 색이 너무 쨍하길래 아이보리로 골랐는데 버터색 같은 느낌이라 정말 맘에 들어요 뒤에있는 라이프썸키보드보단 아이보리에 가까운 느낌?
 다만, 입구가 동봉된 실리콘 빨대 전용이라 그런지 일반적인 유리빨대도 너무 커서 안 들어가네요 동봉된 빨대만 쓰거나 더 얇은 빨대를 사야할 것 같아요
그래도 빨대 꽂을 수 있고 밀폐도 원한다면 이 제품이 제일 좋을 것 같아요 실리콘 빨대 세척도 꽤 편합니다",5
24.05.22.,이쁘네요. 꼼꼼한 만듦새가 좋아요,5
24.04.28.,"디자인 정말 예뻐요!! 선물로 줬는데, 친구가 좋아해요",5
24.04.24.,밀폐 잘돼서 좋아요 근데 다음에 사면 용량 큰거로 살것같아요,5
24.04.12.,빨대가 세척하기 편하게 갈라져 있더라구요 근데 고무빨대라서 적응이 필요할거 같아요 바닥부분에 미끄럼방지도 있고 가볍고,5
24.04.16.,새지않는 텀블러로는 아주 만족스러워요 밀폐잘됨 입구가 커서 씻기 편한데 뚜껑밀폐가 잘되는 만큼 뚜껑을 좀 꼼꼼히 씻어줄 필요는 있습니다 무게는 엄청 가벼운편은 아니고 한가지 불편한점은 넘어졌을때 충격완화를 위해 뚜껑에 실리콘처리가 되어있는데 그부분에 먼지가 잘 붙음 이건 장단점이 있는 기능이라 알아서 잘 선택해야할듯,5
24.04.29.,조아요 가볍고 조어요,5
24.04.26.,살짝 뻑뻑하긴 한데 그래서 밀폐가 잘되니까 좋네요 ㅎㅎㅎ 귀엽고 좋아요~ 빨대도 요긴하게 쓸듯합니다 ㅎㅎ 제 주변의 애기 있는 집은 빨대 좋은것 같다고 빨대만 구매가능하냐고 묻네영 ㅎㅎ,5
24.04.19.,귀엽고 튼튼합니다 책상에 놓을 때도 철 부딪히는 소리가 안 나서 조용한 공간에서 집중되지 않고 좋아요,5
24.03.27.,"모슈 라떼 스트로우 텀블러 하나를 사용하고 있었는데 너무 좋아서 가족 모두 사용하려고 3개 구매했습니다. 연마제 제거 하지 않아도 되고, 결로 현상도 없고, 바닥면 스크래치 방지 리뉴얼이 되어 사용하기 더 편리해 진 것 같아요 만족하며 사용하고 있습니다:)",5
24.04.05.,텀블러 구매하려고 서치하다가 리뷰가 좋아서 구매했어요 화이트색이 가장 깔끔하고 이쁜것같아요 물마시는곳에 음료 고이는거 빼고 너무좋아요,5
24.04.19.,아직 사용전이지만 디자인 깔끔하고 이뻐요!,5
24.04.18.,텀블러 사용에 익숙해 지려고 하는데 쉽지않네요 ㅎㅎ 그래도 예쁜 모슈와 함께 노력할께요!,5
24.03.27.,"모슈 라떼 스트로우 텀블러 하나를 사용하고 있었는데 너무 좋아서 가족 모두 사용하려고 3개 구매했습니다. 연마제 제거 하지 않아도 되고, 결로 현상도 없고, 바닥면 스크래치 방지 리뉴얼이 되어 사용하기 더 편리해 진 것 같아요 만족하며 사용하고 있습니다:)",5
