date,review,rating
23.09.12.,가족 별로 다 쟁인 가족컵! 시원하게 따뜻하게 먹기 좋아요 아무래도 라떼텀블러가 더 보온 보냉이 잘 되기는 하는데 얘도 꽤나 유지력 좋은 편,5
23.10.12.,"디자인 색감 심플하면서 예쁘네요.
실리콘 빨대 아이디어적으로 디자인적으로
만족스러워요.",5
23.10.08.,사용하기 편해요!!,5
23.09.17.,매일 함께하는 텀블러가 되었어요. 씻기도 편하고 가방에 넣고 다녀도 새지 않아서 마음 편합니다.,5
23.09.08.,"집에있는 텀블러는 크기가 작아 큰사이즈커피가 안담겨 어쩔수없이 일회용기를 이용했습니다. 환경생각해서 텀블러 구매를 결정했고 오래사용하려 예쁜 모슈텀블러로 구매했습니다. 고민 많이 했는데 빨리 사서 커피할인 한 번 더 받는게 이득입니다ㅎㅎ 디자인뿐 아니라 온도 유지도 만족합니다. 한여름 회사 점심시간에 산 커피가 오후 5시가 되도 대부분의 얼음이 크기만 조금 작아졌을 뿐 실했어요ㅎㅎ
텀블러 떨어뜨려 기스날까봐 덜렁거리는 성격탓에 어깨끈도 같이 샀는데 뚜벅이한테 찰떡이고 어깨끈은 보는사람 마다 좋아보인다고 말씀하시네요ㅎㅎ",5
23.09.28.,크기도 적당하고 실용적이에요 세척도 편하고 새지않아 좋아요,5
23.10.13.,"보온 보냉이 잘 됩니다..물이 새는것도 없습니다.
단지 뚜껑을 열기가 조금 빡빡하네요..",4
23.10.02.,뚜껑닫고도 안새서 좋은데 그안에 살짝 고여있는걸 완전히 닦아줘야해서 요부분만 개선되면 너무 좋을 것 같습니다! 지금도 너무 만족스러워요,5
23.10.21.,아주 좋습니다. 만족합니다,5
23.08.01.,"진짜 제 머릿속에 상상하던 모든 것이 적용된 텀블러에요. 스트로우 텀블러는 특성상 단점이 너무너무 많았는데 모슈 제품은 스트로우를 쓰지 않을 때도 일반 텀블러처럼 사용가능하고 특히 스트로우가 완전 대박입니다. 안까지 솔 없이 씻을 수 있고 스트로우를 안 쓸 땐 보관하기 편하고 디자인이 너무 귀여워서 당장 질렀어요!! 디자인 뿐만 아니라 보냉력도 우수하고 무엇보다 색감이 진짜 이뻐요!!!! 앞으로 깔별로, 용량별로 하나씩 사서 모을 예정입니다. 텀블러 사는 걸 좋아해서 다른 제품도 많이 사봤는제 제가 이때까지 산 것중에서 제일 마음에 들어요! 다른 제품도 많이 내주세요???? 포장도 꼼꼼하게 잘 와서 기분도 좋았어용",5
23.10.21.,선물했는데 마음에 들어 해서 좋았어요!!,5
23.09.26.,무슨색살까 고민하다가 검정색샀는데 진짜 너무 기엽고 편해요!,5
23.09.26.,배송도 빠르고 색도 예쁘고 가볍고 마음에 들어요,4
23.10.15.,두말하면 입 아픕니다. 늘 자주 이용중,5
23.09.06.,좀 더 연한 아이보리색일 줄 알았는데 꽤 진해요. 그래도 귀여움ㅋㅋㅋ 근데 도색이 벌써 좀 까져서 슬퍼요ㅜㅠ 밀폐는 확실이 되니까 가방에 들고다니기 짱 좋습니당.,5
23.09.08.,리뉴얼전이라 급해서 구매했는데 코스터가 자석처럼 뗐다 붙였다인지 착각했네요! 리뉴얼 되고 구매할거 후회 드나 그거빼고는 색상도 예쁘고 마음에 듭니다!,5
23.10.21.,"무엇보다 색이
맘에 들어요",5
23.10.10.,디자인은 이쁩니다. 무게는 살짝 무거워요,4
23.09.12.,너무너무 좋아하는 컵! 가족들 수 별로 쟁여서 다 같이 마셔요?? 특히 요즘 유행하는 하이볼 먹기에도 좋아요,5
23.09.11.,"한 번 떨어뜨렸었는데 기스 안 나서 놀랐어요ㅎㅎ
빨대는 요새 귀찮아서 그냥 텀블러 안에 넣어 다니는데 이렇게 하니까 편하더라고요
만족템!!",5
23.09.20.,너무 잘 쓰고 있어요!!! 색도 맘에들고 예뻐요,5
23.10.05.,배송 빠르고 좋았어욘 ㅇ ㄹ,5
23.09.22.,빨대 텀블러 찾다가 구입했어용 ㅎㅎ 잘쓸게요~!!,5
23.10.18.,색깔도 이쁘고 가볍고 좋아요,5
23.10.18.,색상도 이쁘고 크기도 딱 적당해서 좋아요~!,5
23.10.09.,직장 출퇴근시 들고 다니면서 사용하고 있어요~ 좋아요!,5
23.08.22.,생각보다 아담해보여서 귀여워요~ 스트로우 한개랑 바닥 실리콘 코스터도 동봉되어 있어요~ 색이 너무 예쁘네요,5
23.06.16.,"모쉬브랜드 것은 처음 사봄.
7년 쓰던  게 상태가 별로여서  
어쩔 수 없이 텀블러 사게 됨.

지인 추천으로 구매.
예쁘고 얼음도 빨리 안녹아서 좋음.
오늘 28도라  금방 녹겠거니 했는데  
많이 안녹았음.

설명서엔가  설명화면에서 보긴 했는데,
이렇게 스크래치가 2개 있는 건 좀...
이러면 금방  까져서 더러워 보이게 됨.

그래서 별 빼려다가 반개는 안돼서 
그냥 5개함.

-----------
-----------라고 씀.

한달 좀 안된 사용 후기
사진 첨부  뚜껑 안쪽 연결부위로
음료가 낌.
세척 후 물기 털어도 조금씩 나옴.
색 진한 음료 마시고,세척하다가 알게 됨.

음용구 근처인데, 곰팡이  생길 가능성이 높음.
아...급 심란해짐.

분리해보려니  벌어지기는 하는데,
요철이 딱 맞아서 어려워 보임.

-------------뚜껑 세척을 위해  분리가 되나,
톡톡으로 상담해봤음.
분리 안된다해서 뚜껑 버리고,
본체는 보냉,보온이 잘 돼서 뚜껑만 교체해서 잘 사용하고 있음.
덜 예뻐지고, 평범해졌지만,
환경을 위해  산 건데  3천번은 써야지.??

뚜껑은 작년에 쿠팡에서 산 건데,
2년째 잘  쓰고있는 거라 혹시 하고 끼워 봄.
딱 좋음. 음료 안새고


(그때는 4년  쓰던, 타 텀블러 뚜껑이 깨져서 버리기 아까워 뚜껑만 알아보니 있어서 구매함)",3
23.09.19.,"보온보냉 기능 좋고 음료 마실때
뚜껑 따로 보관하지 않아도 돼서 편해요.",5
23.10.12.,배송도 빠르고 너무 마음에 들어요,1
23.10.16.,내용물이 새지 않아 좋아요,5
23.10.10.,역시 기대했던대로 이쁘고 좋습니다. 잘 쓸게요,5
23.08.24.,"너무 예쁘고 가볍고 기능탁월하고 백프로 만족해요 ㅎㅎ 핑크색 사려다가 고민하고 아이보리색 샀는데 바나나 우유색인데 좀 더 파스텔톤에 예쁜 색이네용~
담에 핑크색으로 하나 더 사려구요 ㅎㅎ
정말 만족합니다!!! 꼭 구매하세용",5
23.10.16.,디자인이 너무 예뻐용,5
23.09.15.,"이쁜 색상!
그리고 기능도 좋아여 ㅎ
얼음 넣어도 오래 가네요~",5
23.08.13.,진짜 만족스러워요. 가격 면에서 좀 고민했는데 고민이 무색하게도 너무 마음에 쏙 들어요. 디자인이 일단 너무 예쁘고 이 텀블러는 기능이 진짜 최고예요. 보온성 말할 필요도 없고 빨대가 있어서 진짜 좋아요. 그리고 제일 좋은 점! 절대 안 새요. 또 떨어뜨려도 흠집 안나요. 유튜브 보고 샀는데 최고의 선택이에요!!,5
23.10.13.,텀블러 필요해서 찾다가 리뷰가 좋아서 구매했어요,4
23.08.22.,"잘 받았습니다.
연마제 제거안해도 된다는 안내는 삭제하셔야겠어요. 몇번을 닦고 씻어냈는지 모르겠습니다.
내부에 기스자국있고요.",4
23.09.29.,매우만족합니다~~^^,5
23.09.07.,"선물이라서 포장은 뜯지 못했어요ㅠ.ㅠ
모슈 작은 사이즈 텀블러 쓰고 있는데 너무 만족스러워서 큰 사이즈 선물용으로 구매했어요!",5
23.08.12.,여자친구랑 같이 똑같이 구매했는데 저는 텀블러만오고 여자친구는 스트로우도 추가로오고 조금 뭔가 싶네요..? 이건 확실한 불만사항 같습니다만..?,1
23.08.17.,"아직 음료담아 가방에 넣고 다니지 않아 세는 부분은 확인 못 했구요,스벅꺼 살까 한달 고민했는데,좀 저렴이 느낌이에요,뚜껑 열고 사진찍어 봤는데 얼룩덜룩 하네요~",3
23.09.27.,매일 함께하는 텀블러,5
23.09.26.,모스 텀블러 좋아요^^,4
23.09.12.,온 가족이 잘 사용하는 컵! 색도 다양해서 취향별로 골라 샀어요??,5
23.09.23.,잘 쓰고 있어요 디자인 너무 예뻐요,5
23.09.18.,귀엽고 물도 안새고 가볍고 빨대도 쓸 수 있고 최고여요,5
23.09.14.,예뻐요..예쁜거처럼 보온보냉도잘됐으면 좋겠어요,5
23.09.29.,"엄마 선물드렸어요 ㅎㅎ 좋아하시네요
깔끔하고 세척도 쉬워요",5
23.10.05.,"잘 쓰고있어요~
들고다니면서 쓰네요^^
차에서도 굿굿",5
23.10.05.,"잘 쓰고있어요~
들고다니면서 쓰네요^^
차에서도 굿굿",5
23.09.20.,빨간레드 넘 이뻐요,5
23.10.05.,만족도 최상 이쁘고 편하고 잘쓰고 있어요,5
23.09.18.,써본 텀블러중 기능은 젤 좋은듯요,5
23.09.23.,"펀딩으로 몇년전에 샀었는데 너무 오래써서 고무가 찰흙처럼 떨어져서 다시 샀어요
썻던 텀블러중 가장 좋습니다",5
23.09.12.,"색상도 이쁘고 가볍고 용량도 모두 만족 스럽네요
잘쓰겠습니다",5
23.09.18.,뜨거운물 받으면 겉도 같이 뜨거워져요 못잡겠어요,3
23.10.10.,일단 너무 이쁘고 냉온이 너무 잘됩니다ㅎㅎ,5
23.08.20.,"아침에 아아타서 외출하고 오후 늦게까지 돌아다녀도 얼음이 남아있어요 너무 좋아요
빨대도 생각보다 편해요 씻을때도 갈라져서 위생적으로 관리하기도 너무 좋아요
디자인은 말할꺼도 없이 맘에 들어요",5
23.08.15.,여러가지 브랜드의 텀블러를 비교하다가 원하는 기능이 다 있는것 같아 구매했어요. 빨대세척도 쉽고 휴대하기 용이해서 좋고 디자인도 귀여워요. 사이즈도 적당하고 넘어져도 세지 않아서 좋아요. 나만알고싶은데 가지고다니면 은근히 사고싶어하는 사람들이 많네용,5
23.09.08.,"한달동안 열심히 들고 다니면서 쓰고 있어요. 
더운날 최고에요",5
23.09.02.,"디자인, 색감 너무 귀엽고 컵처럼 넓게 나와서 설거지도 편해요. 보냉잘되고 가벼워 들고다니기도 좋습니다. 가격대가 있지만 빨대도 포함되어있고 갈라서 씻을수 있으니 위생적입니다. 다만 빨대가두꺼워서 적응이 안되긴 해요. 나중에 큰사이즈도 구매할 예정입니다",5
23.09.20.,선물로 구매했는데 좋다고하네요!!,5
23.09.16.,좋아요 잘쓰고있어요,5
23.08.30.,"보냉잘되고 너무이뻐요 빨대도 세척이
쉽고 플라스틱 줄일 수 있을고같아소 좋어요",5
23.08.25.,텀블러 사려고 알아보다가 모슈를 알게됐네요. 색은 화이트로 주문했는데 깔끔하고 뚜껑에 네이비색이 있어서 밋밋하지 않아 좋았어요. 받자마자 텀블러에 스티커로 꾸며봤는데 저만의 텀블러가 완성됐네요. 잘 쓰게 씁니다.,5
23.09.22.,크고 너무좋아요~^^,5
23.10.09.,텀블러 너무 귀엽고... 가볍고 사길 잘 한 듯,5
23.09.16.,친구 선물로 줬어요~~ 좋아해요!!,5
23.09.03.,걱정대로 첫날부터 빨대고정 실리콘 잃어버렸어용^^ 전체적으로 예쁘고 가벼워서 좋아요,5
23.10.09.,괜찮아서 선물로추가구매했어요,5
23.08.17.,요즘 잃어버릴까 소중히 가지고 다니는 텀블러입니다. 우선 디자인도 깔끔하고 입구도 넓어서 씻기도 좋고 겉면의 법랑느낌 너무 좋습니다. 색깔별로 다 사고 싶지만 참습니다. 700ml은 차 음료끼우개에 맞지 않을것 같아 480ml샀는데 너무 좋네요~~,5
23.08.30.,제가 원하던 텀블러에 대한 모든것을 만족시켜주는것같아요. 색깔도 너무 예뻐서 깔별로 다 사고싶네요ㅎㅎ,5
23.09.20.,오래오래 쓸 수 있을 것 같아요!!!!!!,5
23.09.18.,빨대도 추가해서 구매했는데 솔직히 별로여서 이거를 왜 돈주고 구매했나 후회했어요 모양은 둥글둥글해서 귀엽더라고요,3
23.09.02.,보온 잘된다고 해서 샀는데 잘 모르깄아요 ㅎㅎ 디자인은 맘에들어용,5
23.10.14.,700ml는 많이 큽니다~,5
23.08.27.,너무 예뻐요 ㅠ 빨대 안으로 밀어 넣고 뚜껑 닫고 다닐수 있어서 최곱니다. 빨때 여분 많이 살껄 그랬우요,5
23.10.04.,선물용으로는 모슈가 최고예요!,5
23.09.06.,컵이 모양이 예쁘고 무엇보다 스트로가 안 새면서 열어서 씻을수있는게 좋아요,5
23.08.11.,"기존에 쓰던 텀블러 뚜껑이 망가지면서 
추천 받아 여기 텀블러를 사봤습니다

기존에 쓰던 것 보다 우선 귀여워서 정말 마음에 들어요그리고 물맺힘 현상도 없습니다
출근하기 전 담아 놓은 얼음도 퇴근하고 집에 갈 때까지 잘 살아 있어요

그리고 자전거 탈 때 쓰려고 보틀 숄더 스트랩도 샀는데
아직 착용하고 나간 적은 없지만 집에서 사용해 봤을 때 괜찮았습니다.",5
23.09.08.,"가볍고 이쁩니다.
제가 구매해서 여자친구한테 자랑하니 저 따라서 바로 샀습니다.

하루 종일 가방에서 뒹굴뒹굴 했는데 한 방울도 세지 않았습니다.

타제품과 비교해 용량 대비 크기가 작습니다. 그런데 성능 차이는 크게 없습니다.

이 녀석... 대단한데?",5
23.09.06.,너무 만족하면서 쓰고 있어서 엄마한테도 모슈의 다른 텀블러 사드렸어요!,5
23.08.10.,"다른 색들도 너무 예뻐서 고민하다 노란색으로 구매했어요
사진은 너무 쨍하게 나왔는데 실물은 더 예뻐요
다회용 빨대는 세척이 귀찮았는데 세척도 간편해서 좋아요 
보온보냉 유지력도 좋은데 예뻐서 아주 마음에 듭니다",5
23.08.23.,"제가 써보고 좋아서 친구 생일선물로 사줬어요!!
리뉴얼돼서 바닥에 내려놔도 소리도 안나고 먼지방지빨대도 좋아요~~!굿굿",5
23.09.21.,쓰고있던건데  좋아서 선물로 하나더 구매 했습니다  깔라가 이뻐요  감사합니다,5
23.09.08.,좋아요 젛아요 젛어요,4
23.09.09.,디자인도 귀엽고 실용성 있어서 좋아용,5
23.09.06.,"친구 선물했어요^^
맘에 든다고 합니다 ㅎ",5
23.09.21.,배송도 빠르고  이뻐요  칼라가 맘에 듭니다,5
23.09.12.,"모슈 유명해서 주문했고
잘쓰고있어요ㅎㅎ",5
23.09.13.,친구선물했어요 이쁘네요,5
23.09.20.,친구 선물로 줘서 만족스럽게 잘쓰는거같아요 다음에 또 구매할게요!,5
23.08.30.,친구한테 선물받고 좋아서 저도 선물용으로 하나 샀어요 마음에 듭니다!!,5
23.08.29.,들고 마시는 제품이 아니여서 그런지 그립감은 별로지만 물안새고 튼튼해보여서 좋네요,4
23.09.20.,얼음도 잘 안녹고 좋아요 ~ 디자인도 귀여워서 잘 쓰고 있습니다 ㅎㅎ,5
23.09.10.,"깔끔하고 좋아요
배송도 빨라요",5
23.08.28.,가볍고 그립감 좋아요. 보냉 유지력도 만족스럽습니다,5
23.08.31.,생각보다 가벼워서 들고 다니기도 좋고 보냉도 잘 되는 거 같고 디자인도 귀여워요~,5
23.09.10.,예쁘고 가벼워서 좋아요!,5
23.08.05.,"일단 너무너무 이뻐요 :) 디자인 대만족!!
보온보냉기능은 모슈제품을 이미 사용하고 잇어서 잘되는걸 알고잇엇어요~! 모슈제품은 디자인 보온보냉 가격 모두 너무나 만족스럽네요~! 
아 빠르고 안전한 배송도 좋았습니다",5
23.07.26.,전에 모슈 350ml 다른 거 샀었는데 입구가 좁아 얼음이 안 들어가더라구요ㅠㅠ 그래서 입구 넓고 좀 더 큰 거 사야겠다 해서 사봤는데 너무 맘에 들어욜!!! 디자인 세상 예쁘고 전에 350ml 샀을 때 기능도 괜찮았어요 매일 들고 다닙니당,5
23.09.03.,"디자인도 예쁘구 크기도 좋구, 보온 보냉 능력도 좋고, 세척하기도 좋은데 단 한가지 기스에 취약해요 ! 아주 살짝 그렇게 딱딱하지 않은 곳에 떨어트렸는데 벗겨졌어요ㅠㅠㅠ 그게 아쉽지만 나머지가 다 좋아요 !",5
23.09.28.,디자인이 심플하니 이뻐요,5
23.09.09.,계속 잘 사용하고 있습니다,5
23.08.30.,대박 만족하면서 쓰고 있어요,5
23.09.07.,깔끔하고 예쁨 근데 떨어트리면 와장창 될듯 ...,5
23.09.20.,"잘 쓰고 있습니다
같이 온 빨대는 계속 들고 다니고 설거지 하기 귀찮아서 결국 안 쓰고 있네요 ㅠ ㅋㅋ",4
23.09.06.,"이전에 화이트색상으로 사용하고있다가 신랑이 계속 제꺼를 탐내서 신랑껄로 하나더 샀어요 
사진상으론 무광으로 보였는데 유광 확실하고요 벗겨짐은 역시나 덜해보입니당!!",5
23.09.07.,좋어용 굿굿 최고 이뻐요,5
23.09.16.,색도 이쁘네요  넘좋아요,4
23.09.14.,실물이 더 귀여워요! 기능도 만족합니당,5
23.09.17.,"한달 동안 쓰면서 문제는 너무 무겁다는
점이고 가끔 물이 뚜껑쪽에 셀때가 있어요 ㅜ",4
23.09.26.,디자인이 이쁩니다.,5
23.09.15.,뚜껑으로 마시면 내용물이 조금 고여있어서 닦아주긴해야하지만 보냉잘되요~,5
23.09.15.,아주 만족스럽습니다. 스벅 텀블러 이제 안녕,5
23.09.06.,흔들어도 물이 안 새서 밀폐력도 좋고 보냉도 잘돼요! 예뻐서 조아욤,5
23.08.30.,씻을때 텀블러 안에 손이 들어가서 좋아요~,5
23.09.06.,너무 귀엽고 예쁘요,5
23.08.16.,"작은 사이즈 헬스장 갈때 쓰다가 회사에서도 물 시원하게 마시고 싶어서 큰 사이즈로 사서 너무 잘 쓰고 있어요
색감도 너무 예쁘고 최고입니다 ????",5
23.08.14.,"보냉효과 진짜 좋아요 얼음도 안녹고
디자인도 심플해서 너무 이뻐요
더작은 용량 다른색상 살까 생각중이예요",5
23.09.13.,고무 빨대가 있어서 사용하기에 매우 좋습니다. 보온/ 보냉도 좋아요!!,5
23.09.14.,"보온보냉기능 완벽하고
디자인이 너무 귀여워요
조금 더 큰 용량 살껄 후회중 ㅠㅠ",5
23.06.10.,"타사 텀블러 여러개 가지고있는데
400미리대는 없는데다가
모슈 텀블러 디자인이 너무 마음에 들어서 구매해보았어요
빨대도 생각보다 마시기에 불편함이 없었고 밖에서 꼽아서 쓰다가 말아서 보관했다 하긴 어려울것같아요ㅎ
차라리 텀블러에 꼽은상태로 밀어넣고 뚜껑닫는게 더 나을것같아요

일반 유리빨대도 호환가능해서 집에서는 유리빨때 꼽아 사용하니 좋았는데 
저는 자몽에이드를 자주 만들어서 마시는데 입구가 작아서 뚜껑을 분리하지 않으면 큰빨대를 쓸수없는점이 아쉬웠고ㅜ
그리고 빨대로 계속 마셔서 몰랐는데
밖에 들고나가서 입대고 커피 마시다가 뚜껑닫았더니 입대고 마실때 조금 고여있던게 저렇게 텀블러 뚜껑쪽에 묻어있던데 가방안에서 굴렀으면....다른물건에 커피 얼룩남을뻔했네요ㅠㅠ

밑바닥 실리콘은...안사도 되는거였네요ㅠㅠ 이미 바닥이 실리콘으로 되어있어서 어디다 써야할지..",5
23.09.15.,보냉은 좋아요 음료투출구에 음료가 잘 고여요,5
23.07.23.,모슈 우유병모양 텀블러를 5년정도 사용하고 선물도 주고해서 세 번째 구매입니다 디자인 너무 예쁘고요 빨대 먼지안묻게 코팅되어있어서 좋아요 잘쓸게요,5
23.07.18.,크기도 괜찮고 탄탄해보이고 좋아요. 그런데 새상품인데 찍혀서 도장이 까져있어서 속상했어요..  ㅜ 반품왔다갔다 오래걸릴꺼같아 그냥쓸라구요 ~ 텀블러자체는 괜찮습니다.,4
23.08.01.,리뉴얼 전 첫 런칭 때부터 사용했는데 최근 가족들이 이 매력을 알아보고 주문해 달라고 해서 취향대로 구매했습니다ㅎㅎ 제 눈엔 역시 화이트가 젤 예쁘긴 하지만 리뉴얼 된 부분도 부럽긴하네요!,5
23.07.27.,"저는 은근히 실리콘빨대 안쓸줄 알았는데 너무 편하네요 디자인도 귀여워서 회사랑 집
왔다갔다하면서써요 뚜껑세척도 간편해요 스벅 텀블러 진짜 뚜껑ㅡㅡ공간도좁고 불편해서 갈아탄건데 너무 편안하게 세척합니다",5
23.08.19.,보냉도 잘 되고 입구가 넓어서 설거지 할 때 편해서 좋아요,5
23.08.18.,"저가 먼저쓰고. 남편일하는데 얼음물 담아보내야겠어서. 구매했습니다
얼음이 오래가니 너무 좋아요
가격은 좀 하지만. 그정도는 괜찮아요
용량도 크고 
좋은제품. 감사합니다",5
23.08.28.,"동생의 요청으로 구매했는데
사용하는거 보니 좋네요.. 현제 쓰고 있는 텀블러 고장나면 젤 큰걸로 추가 구매 하겠습니다 ㅎ",5
23.06.09.,"정말 너무 좋아요... 리뷰 잘 안쓰는데 너무 마음에 들어서 안 남길 수가 없었어요. 원래도 모슈 제품 넘 이뻐서 탐냈었는데 이번 텀블러는 제가 갖고 싶던 스트로우 텀블러 + 밀폐가 된다고 하니 안 살 수가 없었고요... 빨대까지 같이 수납해서 들고 다닐 수 있는 거 진짜 최고예요... 어떻게 이럴 수가 있는지???
의외로 감탄했던 거 진짜 컵이 두께가 얇아서 크기가 부담스럽게 크지 않은데도 음료 많이 들어가서 너무 좋고요..
여름엔 집에서도 보냉컵만 사용할 정도로 미지근한 음료며 물 마시는 것도 싫어하는데... 보냉도 잘 돼요 얼음 잘 안 녹고 기능에 무리 없음! 두께가 얇아서 혹시나 했던 걱정이 다 쓸모없었어요,,
그리고 색깔도 버터색 비슷하게 너무 너무 귀엽고요..
빨대도 이런 형태는 처음 써봐서 걱정했는데 걱정이 무색하네요..
새거나 그런 것 없이 좋습니다. 빨대 세척솔이 있는데도 귀찮아서 다회용 빨대를 잘 쓰게 됐었는데, 이 빨대는 닦는 게 일반 수세미로 가능해서 잘 쓰게 될 것 같아요.
그동안 텀블러 무수히 많이 바꿔 쓰면서 뭔가 하나씩 항상 아쉬웠었는데요.. 그래서 이거 사면서도 사실 찬장에 텀블러가 넘 많아서 죄책감도 들었고여.. 근데 이제 정착할 수 있을 것 같습니다.
뭐하나 빠지는 것 없이 (제게) 완벽한 텀블러...
감사합니다 복 많이 받으시고.. 또 좋은 거 만들어주세요..ㅠ",5
23.08.19.,예뻐요 색별로 모르고싶어요,5
23.08.23.,배송도 빠르고 제품도 맘에 드네요.,5
23.09.12.,"색, 디자인 너무 예쁘고 좋습니다~",5
23.08.05.,디자인도 예쁘고 맘에 듭니다 가격대비 잘 산거같네요~,5
23.08.29.,잘 쓰고있습니다~~,5
23.08.24.,색상이랑 넘 이빠요..좋아요..,5
23.07.31.,"배송, 포장상태는 빠르고 좋았습니다.
보냉 상태는 만족해요, 천천히 먹는 편인데 다 먹을때까지 얼음이 80프로 이상 녹지 않았던거 같아요
실리콘 빨대는 세척면에서 좋았으나.. 먹을때 촉감이 별로이긴 하더라구요;;",4
23.08.08.,"블랙색상 귀여워요!! 같이 시킨 핸드슬리브도
비싸지만 귀엽네요ㅎㅎ",5
23.08.04.,가방에 넣어도 샐 일이 없다고 생각하니까 편하게 매일 쓰게 되어요. 디자인도 예쁘구ㅎㅎ 스트로우는 따로 쓰는중이에요..,5
23.08.12.,디자인도 귀엽구 원하는 기능인 밀폐랑 빨대가 있어서 좋아요,5
23.06.15.,"가격대가 있어서 좀 고민해써여 집에 텀블러는 있는데 여름이
되니
스트로우가 같이
있는게
좋을거 같은데
환경생각하니
고민이
되더라구요. 
근데
후회는
없습니다. 너무 크거나 작지
않거 뭣보다 기존 텀블러 이거보다 용량 작은데도 크기가 비슷해서 놀랐어요. 보냉은 쏘쏘 구요. 
실리콘이다보니 처음에 냄새가 좀 나고 스텐에서도 좀 그랬던거 같어여. 음료먹으면서 좀 역했는데 저만 그럼건지.. ㅠㅠ 일단 지캬보고 있고 나머지는 다 완벽하게 마음에
듭니다. 기존 실리콘들보다 빨대도 좀 먼지가 덜 붙네요. 보완을 해서 재 출시를 한 점 박수!!
그리고 옵션에 텀블러 가방 꼭추천해여. 텀블러 사이즈별로 맞춰나와서 딱 안정적으로 맞아요! 
이동이
편해졌어요!",5
23.08.21.,귀엽구 보온이 잘되네요!,5
23.08.14.,색상 걱정많았는데 상세페이지보다 실물이 훨씬 이쁘고 귀여워요!!!,5
23.09.01.,친구선물로 보내줬어요 너무 만족스럽다고 하네요,5
23.08.30.,잘 쓰고 있었는데 조금 약한가봐요ㅜ 찌그러졌어요ㅜㅜㅜ흑 그래도 넘 예뻐요,4
23.09.09.,물병 정말 귀엽습니다,5
23.08.08.,보온이 잘된다고 하고 빨대도 있어서 잘쓸거 같아요 디자인이 넘 예뻐요,4
23.08.10.,"모슈 디자인 진짜 넘귀
솔직히 텀블러는 세척 편한게 최고 
앞으로 여기서 쭉 사야징",5
23.09.04.,디자인도 예쁘고 ~ 얼음도 오래가서 친구 산물도 하나 더 구매합니다~^^,5
23.08.17.,예쁘고 보냉효과가 좋아요,5
23.09.01.,텀블러 너무 귀여워요 빨때도 세척하기 편하고 좋아요!!,5
23.07.21.,친구 취업 선물로 사줬는데  새지도 않는다라고 생긴 곳이 압도적으로 귀엽기 때문에...대만족입니다. 최고  귀여움??,5
23.08.19.,에뻐요  색별데로 다모으고싶네요,5
23.08.10.,보냉효과가 아주 뛰어나요 맘에 들어요,5
23.08.21.,매우만족합니다~~^^,5
23.08.03.,"진짜 텀블러 중에 최고예여
재구매 한거임!!
킹왕짱입니다요",5
