date,review,rating
23.03.20.,정말 제가 써본 텀블러중에 가장 실용적이고 예쁘고 좋습니다.. 텀블러 사면 길어야 한달 사용하고 처박아 놓는데 이건 매일매일 쓰고있아요 ..!,5
23.03.28.,튼튼해보여요. 아직 더 써봐야 알겠지만 좋을것 같아요.,5
23.04.09.,"너무 이쁘고 산뜻한 컬러라 마음에 들어요
가볍고 그립감 좋아 자주 손이 갈것 같아요",5
23.04.13.,같은 제품을 분실하여 재구매! 살짝 뚱뚱(?)한 그립감이 조금 아쉽지만 그부분 제외하고는 좋습니다.,5
23.03.21.,"제가 예전부터 예뻐서 찜해둔걸 
딸아이꺼 사려고 고르는데 자기가 골라둔게 이거라네요^^

받았는데 넘 예뻐요^^",5
23.03.30.,너무 귀엽고 너무 질이 좋음,5
23.04.18.,"일단 가방에 넣을 수 있어서 좋고, 디자인도 긔염뽀짝하니 좋습니다!!",5
23.04.04.,배송이 빠르고 좋아요,5
23.03.01.,"일단 디자인이 너무 예뻐서 볼 때마다 기분 좋아져요
480ml 들어가는 것치고 크기도 작아서 휴대하기도 편합니다 얼음도 오래가고 잘 안 새요! 
화이트 색상은 딱 우유색이라고 생각하시면 될 것 같아요 아이보리랑 고민했는데 화이트 너무 예쁩니다",5
23.03.13.,기존에 라떼 텀블러 쓰다가 좁은 입구때매 얼음 넣기에 불편해서 스트로우 텀블러도 구매했어요~  모슈 보온보냉 잘되는건 알고있어서 의심없이 구매했습니다~! 잘쓸게요 ~~,5
23.03.13.,너무 귀엽고 특히 빨대를 뚜껑에 끼워서 보관할수있어서 좋아요!!! 흰색과 파란색 조화도 맘에 듭니다,5
23.04.05.,입구가 넓어서 설거지하기 좋구요 숙 상디자인 내구성 아주 좋습니다,5
23.03.23.,"이쁘고
계속사용하고싶어용
근데ㅜ먹을때
코끝부분이 위에닿아용ㅜ이것만조금불편합니다!",5
23.03.29.,텀블러중 일짱이네요 절대 안샘,5
23.03.15.,아직 사용전이지만 리뉴얼된 스트로우와 밑받침으로 와서 좋아요~ 곧 무광도 나온다고 봤는데 기능까지 좋으면 무광도 구매할 예정입니다!,5
23.03.16.,정말예쁩니다. 맘에들어요 뚜껑부분이 살짝 튀어나와있어서 텀블러 놓치지 않을 수 있고 좋아요,5
23.04.01.,700미리 짜리 사고 좀 크고 무거워서 다시 구매했어용,5
23.04.21.,"디자인, 그립감, 컬러, 보온, 정말 좋네요",5
23.03.21.,"디자인도 예쁘고 보온병치고 가볍고, 특히 스트로우를 말아서 가지고 다닐수있는게 큰 장점인것같아요 .(스트로우 세척역시 최고)  스*** 텀블러 한번 놓쳤다가 안에 플라스틱 깨져서 진짜 돈아깝다 하고있는 와중에 발견해서 잘 사용중입니다",5
23.03.19.,보냉이 잘 돼요. 색도 따뜻한 화이트여서 귀여워요.,5
23.04.18.,용량 작은거 샀다가 너므 맘에들어사 큰거 샀어용~,5
23.03.05.,"잘 새지않고 보냉, 보온 기능 있고 가볍고 입구가 넓은 텀블러 찾는데 모두 다 부합하네요 무엇보다 디자인도 이쁘고 스트로우 세척이 쉬운 것도 마음에 들어요",5
23.04.18.,그래도 먼지가 안붙는건아니예요 그래도 빨대 안쓰시는분들은 괜춘,4
23.04.23.,예쁘고 통도 적당하네요,5
23.02.23.,"다른분 후기대로 빨대 미사용 시 코에 닿아서 조금 불편하긴 한데 뭐 큰 불편함은없어요!
빨대 세척 할 수 있게 만든건 정말 굿 아이디어 같아요 ㅋㅋ 레드도 화면과 똑같아서 대만족 합니다!!!",5
23.04.21.,사진과 같습니다 얇고 가볍습니다,5
23.03.30.,물 양이 많이 들어가서 좋아요,3
23.03.28.,디자인 깔끔하고 실용성있고 좋아용,5
23.03.19.,"대용량 텀블러가 필요해서
찾아보다가 알게되었는데
디자인도 예쁘고 크기도 너무 좋아여",5
23.04.04.,예뻐서 선물예정 감사:),4
23.04.13.,선물용으로 샀는데 배송이 빠르네요. 좋아요.,5
23.03.10.,"원하는 사이즈, 색상의 텀플러를 찾게 되어서 좋아요. 그런데 뚜껑에서 냄새가좀 나는데 시간이 지나면 없어지겠죠?",5
23.03.30.,예뻐서 샀는데 왠지 잘 안 쓰게 되네요,4
23.04.16.,이쁘고 큽니다700ml 아메리카노 2잔 담을 수 있어서 좋아요~,5
23.03.21.,"사무실에서도 집에서도 얼심히 사용할께요.
이쁘면 다냐구요? 네 다 입니다",5
23.03.28.,"종종 물이 샌다는 후기가 있어서 받자마자 물넣고 뒤집어서 물새는거 확인했는데 괜찮았습니다.
디자인은 보는 그대로이고 귀엽습니다.
근데 생각보다 좀 통통해요",5
23.04.16.,"선물용으로 샀는데
마음에 들어하네요.",5
23.02.18.,"디자인 너무 이쁘고 얼음 넣기 너무 편하고 씻기도 편해서 만족합니다 .   1달 이상 써보니 .  뚜껑 안쪽에 요철이 너무 많아 세척이 아주 불편하고  아이스 와 뜨거운 음료의  온도 지속 시간 차이가 상당히 많이 나네요 .  얼음음료는 24시간도 유지 가능한데 뜨거운 음료는  몇시간이면 미지근 해져요 .  제 기준에 제일 불편한 것은 뚜껑세척입니다 . 
전체적으론 편하게 잘 써서 만족스럽지만 조금만 개선되면 좋겠네요",4
23.03.22.,선물했는데 기존에도 사용하던거라고 합니다~~ 좋습니다 아주 이뻐용,5
23.03.06.,"밀크 텀블러 써보고 너무 좋아서
라떼스트로우텀블러도 구매했습니다.
엄마 사드리고 너무 좋아서 저도 구매해요! 
보냉 유지력이 정말 최고",5
23.03.22.,가벼워서 좋아요! 잘 사용중입니다!,5
23.03.27.,정말 음료 안새고 너무좋에뇨,5
23.04.08.,먼지가 잘 붙어요.. 디자인은 이쁜데 실용성이 떨어지네요 ㅠㅠ,2
23.03.10.,"아직 쓰기전이지만 디자인 맘에 들어서 구매했어요
잘쓰겠습니다!",5
23.03.08.,"색상 고민하다 화이트로 했는데, 너무 만족합니당 빨대는 일회용으로 사용할까 싶은데 생각보다 용량도 크고 보온, 보냉 잘 되네요~",5
23.03.26.,디자인이 예쁘고 가벼워요,5
23.03.07.,일단 색감도 디자인도 이쁘고 관리하기도 편할 것 같네요. 빨대가 좀 신기한데 세착하기도 쉬워요^^까페에서 일회용품 안 쓰려 사봤는데 요긴하게 잘 쓸듯요.,5
23.03.29.,예쁘고 사이즈도 적당하네요^^,5
23.03.09.,일간 색상이 넘 예뻐요 빨대 추가 구입했는데 한개에 팔처넌이었네여.. 왜 세개라고 생각했을까여...ㅋㅋㅋ 1개가 안와서 이상하다 생각하고 문의할뻔 ㅋㅋㅋ 그리고 480ml페이지에서 구매해서 당연 480 선택한줄 알고 받았는데 상자에 350이라고 되 있어서 잘못왔나 했더니 잘못 선택한거더라구요..ㅠㅠ 반품 귀찮아서 걍 480ml 하나 더 구매합니다..ㅠ 가격이 비싸서 고민은 좀 했지만 350은 넘 작아여...ㅋㅋ 따뜻한거 마실땐 좋을듯 ㅋㅋ,5
23.03.05.,"흰색 주문하려다 제 실수로 빨강이가 왔는데 이뻐서 그냥 쓰기러했어요 ㅠㅠ
빨대가 아직 적응이 안돼긴 하지만 이뻐서 만족~",5
23.03.23.,제가 쓰고 좋아서 선물했는데 받은 사람도 좋아했어요ㅎ,5
23.04.14.,깔끔하고 보온보냉 잘돼요. 굿,5
23.03.11.,맨날 플라스틱 빨대 사다가먹었는데 이거는 텀블러에 빨대까지 있어서 더이상 플라스틱 안써도 돼서 좋은거같아용~,5
23.04.12.,700ml 쓰고 있는데 너무 만족해서 추가 구입했습니다.,5
23.03.20.,선물하려고 구입했어요 ㅎㅎ 예뻐서 저도 사고 싶어요ㅠㅠ,5
23.03.22.,보냉이 아주 잘되고 빨대도 마음에 들어요~!,5
23.03.27.,틈이없어서 절대 안흘러요,5
23.03.22.,"기존에 쓰고 있는 제품이예요 
잘쓰고 있어 친구에게도 선물 했어용 ㅎㅎ",5
23.03.06.,"가격은 좀 비싼듯 생각했는데 색상도 제품도 모두 만족합니다.
기능도 정말 굿입니다.
많이 파세요",5
23.03.10.,너무 예쁩니다!! 기능도 좋구 맘에 들어요ㅠㅠ,5
23.03.05.,예쁘고 뚜껑 잘 닫으면 새지도 암ㅎ아요 ㅎㅎ 빨대 텀블러로도 쓰고 그냥 마시는 텀블러로도 최고에요  텀블러 매니안데 이거 사고부터 이거만들고다님,5
23.04.15.,귀여워요감사합니당~~,5
23.03.26.,기존에 다른 제품 쓰다가 만족해서 선물용으로 구입했어요 받은 분도 엄청 만족하셨구 저도 하나 사려구요!,5
23.03.20.,디자인이 예쁘고 기능이 정말 좋아요,4
23.04.04.,디자인이 넘 예쁘네요. 용량도 크고...,5
23.02.26.,스트로우 하나 더 추가해서 구입 했어요. 모슈는 예전부터 쓰던 텀블러가 있어 성능 좋은 것은 이미 알고 구입했어요. 입구가 넓어 얼음 넣기도 좋고 설거지 하기도 좋아서 마음에 들어요,5
23.04.16.,편하고 좋은거 같아요,5
23.03.07.,배송이 너무 빨라서 좋고 색감도 화면과 같아서 좋아요! 생각보다 가볍기도 합니다.,5
23.04.07.,"생각보다 보냉 기능이 아쉬우나
디자인이 좋으니까요~",5
23.04.09.,뚜껑이 코에 닿는 것만 빼면 편하고 좋아요 ㅎㅎ,4
23.04.12.,"색감 너무 예쁘요... 
오래된 텀블러 버리고 바꿨어요!",5
23.03.01.,리뉴얼된 버전이 더 마음에 들어요 색상도 예쁘고 손이 잘 들어가는 사이즈라 세척도 쉽고..요새 덕분에 플라스틱 사용도 줄이고 아주 좋습니다,5
23.04.05.,넘 예뻐요 진짜 안샜으면 좋겠어요,5
23.03.13.,여자친구 사무실에서 쓴다고해서 구매했는데 너무 좋아하더라구요,5
23.03.10.,"선물용으로 구입했는데 빠르게 배송 해주셔서 
감사해요 
너무 이뻐요",5
23.04.06.,일단 텀블러가 이쁘고 되게 간편해서 좋아요,5
23.03.09.,너무 이뻐요~! 노란색이 있는데 추가 구입했어요~! 누수없고 보냉 잘돼구 무엇보다 세척이 너무 편해요! 디자인은 말하면 입아픔 ㅋㅋ 그냥 고민하지말고 사세요. 주변에서 다 이쁘다고 난리예요.,5
23.03.29.,엄마가 필요하다고 하셔서 사드렸는데 만족하시네요 ㅎㅎ 잘 산듯합니다~!~!,5
23.03.18.,아주 맘에듭니다 . 씻기 편허겠어요,5
23.03.21.,나만 알고싶은 예쁜 모슈♡♡,5
23.03.04.,디자인이 너무 예뻐요. 색도 마음에 들고...음료 마시기 편해서 자주 사용할거같아요.,5
23.02.08.,텀블러 받자마자 되게 얇아서 놀랐어요 무게도 당연히 가볍구요 다른 텀블러는 입구가 좁아서 손 넣어서 닦기가 힘들었는데 이건 입구도 넓어서 닦기 편해요 받자마자 물 넣고 흔들었는데 밀폐력 아주 좋아요 실리콘 빨대도 좋아요 빨대가 펼쳐지니까 빨대 안에 이물질 닦을 때 좋을 거 같아요,5
23.03.10.,너무 예뻐요~ 물 많이 마실게요!!ㅎㅎ,5
23.03.21.,소개에 써잇는 장점 그대로 다 좋습니다. 특히 밀봉되는게 최고!! 근데 먹을때 코에 닿아서 살짝 아쉬움요,4
23.03.16.,보냉도 잘되고 만족합니다.,5
23.03.21.,텀블러 열심히 들고다니는 중♡,5
23.03.15.,양을 넉넉히 넣을 수 있다는 점이 좋아요,3
23.03.15.,양을 넉넉히 넣을 수 있다는 점이 좋아요,3
23.03.15.,친구한테 선물로 줬는데 너무 좋아 했어요!,5
23.03.16.,생각보다 크기가 크긴 하지만 좋아요????,5
23.03.08.,너무 너무 마음에 들어요.^^ 작은 사이즈도 하나 살까 고민중입니다.^^,5
23.03.30.,색깔이쁘고 기능도 좋네요 만족만족,5
23.03.30.,조아요 이뻐용 짱이에여,5
23.03.08.,"배송도 빨리오고 디자인도 좋은데, 가방 안에 넣고 다녔더니 하루만에 겉부분이 긁혀서 슬프네요 ㅠㅠ",5
23.03.07.,보온성이 막 좋다!!! 는 아니지만 충분히 지속력이 있구 또 빨대도 있어서 편하게 먹을 수 있어서 좋아요,5
23.04.11.,모슈꺼 다 사고 싶어요~~~~,5
23.04.06.,디자인이 너무 예뻐요,5
23.03.04.,"친구 생일선물로 보내줫어요!! 친구가 만족해해요
좋대요 ㅠㅠ감사합니다??",5
23.03.29.,선물했는데 받는 사람이 만족 했어요 감사합니다,5
23.03.08.,"배송 진짜 빨라요 ㅎ
색상도 예쁘고 잘 사용할게요",5
23.03.02.,너무 좋아요.. 예쁘고 제가 원하던 실용성과 미학을 다 갖고 있네요,5
23.03.29.,빨대가 생각보다 쓸만하고 너무 귀여워서 만족하고 사용하고 있습니다,5
23.02.19.,디자인 정말 마음에 들고 가벼워서 좋아요! 얄쌍해서 가지고 다니기에도 좋습니다!! 근데 리뉴얼되었어도 먼지는 여전히 잘 붙습니다ㅠ,5
23.03.16.,너무 예뻐요 좋아요,5
23.03.01.,"디자인은 말할것도 없이 깔끔한 색상의 파스텔톤이라 예쁘고 , 용량도 충분하고 생각보다 세척도 편리합니다",5
23.03.19.,"조금은 쓸데없는 선물로 준 건데 친구가 굉장히 만족했어요.
화면이랑 똑같이 아주 귀엽게 생겼어요.",5
23.03.04.,400ml대 텀블러를 진짜 많이 알아봤는데 제일 슬림한것 같아요 넘 귀엽구 잘쓸고같어요~~,5
23.03.16.,실물이 더 예뻐요.,5
23.04.02.,잘 쓰고 있습니다! bb 좋아용,5
23.03.03.,화면과 같고 귀엽습니다.,4
23.03.28.,재구매입니다. 굿~~ 사용이 편해요,5
23.03.02.,"뚜껑 열고 닫고만해봐도,
안세고 튼튼할거 같습니다~^^
매우 맘에 들어요~~~",5
23.03.05.,생각보다는 안 컸어요. 기능은 좋네요~,5
23.04.07.,여름용으로 샀어요.,5
23.03.11.,가방에서 흐르지않아서 좋아요!,5
23.03.25.,예쁘고 쓰기 너무 편해요. 매일 챙겨 다니구 있어요!,5
23.02.18.,보온력은 좋네요.화이트 깔끔하니 손에 잡기 편하니 좋아요,5
23.02.10.,"디자인도 기능도 마음에 쏙 듭니다. 
종이빨대는 금방 물러서 쓰기 어렵고, 플라스틱 빨대는 일회용이라 마음이 불편했는데..아이와 나들이할때 휴대용 실리콘 빨대가 열일하네요 =)",5
23.03.16.,다른 리뷰 처럼 뚜껑 세척이 어렵다는 점만 빼면 너무 마음에 들어요 :),5
23.02.16.,"쓰다보니 보냉력이 살짝 떨어진건지,.?싶은 느낌 기분탓일스더 있어용 하지만 예쁨",5
23.01.08.,"480과 710 엄청 고민을 했는데 480 사길 잘한 것 같아요! 무게도 가볍고 가방에도 들어가서 좋아요^^
리뷰처럼 입구에 음료가 고여 있는 점은 아쉽긴 하지만 잘 닦으면 되니까^^;!!! 밀폐력은 정말 좋으나 보냉효과는 사실 드라마틱 하진 않은 것 같아요! 
그래도 크래프트 아이스가 들어가고, 세척이 쉽고 가벼운 텀블러 찾아 해메던 저에게 모슈는 최고의 선택이였습니다! 디자인은 뭐~ 말할 것도 없죠^^ ?? 480도 리뉴얼 부지런히 되서 다른 컬러도 겟하고 싶어요!",5
23.02.15.,전에 쓰던 텀블러와 크기는 비슷한데 무게는 훨씬 가볍습니다! 넘 만족해요 ㅎㅎ,5
23.01.29.,350ml짜리와 고민하다가 샀는데 생각보다 크지 읺아서 더 마음에 들어요! 색상이랑 디자인 모두 맘에 들지만 무엇보다도 셀 걱정 없이 가방에 넣고 들고다닐 수 있어 너무 마음에 들어요,5
23.02.12.,"디자인이야 뭐, 영롱하고 예쁘구요. 
기능은 제 주변 친구들 다 모슈꺼 씁니당

잘못 주문했는데 처리가 빠르게 잘 해주셨어요
굿",5
23.03.02.,배송이 빠르고 좋아요,5
23.02.17.,2번째 사는 모슈 제품이에요. 너무 예쁘고 좋은데  제꺼는 물이 좀 세내요.. 혹시 불량인걸까요,3
23.03.05.,스댕 텀블러임에도 불구하고 가볍습니다. 그런데 보온력도 좋아서 기능성 디자인 가격 모든게 완벽합니다.,5
23.02.09.,예쁘고 젛아요 특히 빨대를 같이 준다는 점이 마음이 들어요 입구가 생각보다 좁아서 세척 시 텁블러 세척솔을 사용해야 해요,5
23.02.27.,"엄마가 필요하다고 해서 사줬어요 
무거운거 빼고는 다 좋대요 ㅎㅎ",5
23.02.24.,뚜껑이 샐 염려가 없어서 좋아요~ 색 고민 엄청 하다가 빨강했는데 선명하고 따뜻한 보온 잘 될 것 같은 빨강이에요 ㅋㅋ 텀블러 가방 껴주니 귀엽고 빨간색이랑 잘 어울립니다 좋아용,5
23.03.12.,친구 생일선물로 구매했는데 친구도 마음에 든다네용~~!! 저도 사야겠어용,5
23.03.19.,아이보리 색상 처음 샀는데 너무 이뻐여ㅠㅠㅠ,5
23.03.18.,진짜 슬림하고 너무 예뻐요,5
23.02.21.,뚜껑 거꾸로 들고 있다가 빨대 잃어버린거 말고는 다 맘에 들어요??,5
23.03.06.,"빨대를 열어서 세척할 수 있다는 점이
제일 마음에 들었습니다! 또 내용물이
새지않아 안심돼요",5
23.02.26.,좋아서 자주 구매합니다  조아요,5
23.03.14.,디자인이 귀엽고 세척도 편해서 좋아요,5
23.02.24.,딱 제가 생각했던 그대로예요. 예뻐요,5
23.03.08.,"제자 중학교선물한건데 노란색 마니아라
넘 좋아하고 잘사용하고 있네요~~~고급져요!!",5
23.02.25.,선물했는데 마음에 들어해요!,5
23.03.13.,생각한대로네요 맘에 들어요,5
23.03.02.,"텀블러 너무 예쁘고 활용도도 좋아요
빨대 세척은 가정에서 하면 보통 세척솔이 있기 때문에 오히려 불편한데 사무실에 놔두고 쓰기엔 참 좋을 것 같아요",5
23.01.25.,"너무 귀엽구요 실리콘(?) 빨대는 처음 써보는데 이질감도 안들고 좋네요. 빨대있는 텀블러 쓸 때 뚜껑을 못닫고 다니는게 싫었는데 뚜껑닫고 실리콘 빨대 둥글게 말아서 같이들고 다닐 수 있다는게 최고 장점같아여ㅎㅎ 잘쓰겠슴당
배송도 겁나 빨랐어요",5
23.03.20.,만족합니다만족합니다,5
23.02.17.,직장에서 잘 사용하고있습니다~~ 750ml  ㅋ 생각보다 크네요 ㅋ,5
23.02.21.,빨대에 하얗게 끼는 거 빼고는 좋아요,5
23.03.03.,"원래 모슈 텀블러 잘 사용했었는데, 회사에서 사용하려고 하나 더 샀어요. 예쁘고 가볍고 좋아요!",5
23.03.05.,상품평들이 왜 좋은지 알겠어요 디자인도 예쁘고 실용적입니다,5
23.02.27.,"약간 뚱이어서 세척이 아주 편해요. 
빨대도 일회용이 아니라 마음에 듭니다.",5
23.02.10.,진짜 이쁘게 생겼어요. 아이보리보다는 슈크림색! 마음에 듭니다,5
23.02.24.,디자인도 이쁘고 넘 귀여워요~!!,5
23.01.12.,색이 넘 예뻐요ㅜㅜ개인적으로 텀블러에 같이오는 딱딱한?빨때 싫었는데 이건 실리콘이라 맘에 들어요 그리고 뚜껑이 돌려서 닫는거라 그런지 내용물이 전혀 흐르지않습니다 여기저기 부딪혀도 기스도 잘안나고 아침에 얼음꽉채워넣으면 밤까지 반정도는 유지됩니다 비싼값하네용 ??,5
23.02.07.,"디자인 너무너무 귀엽고 기능도 마음에 들어요!! 
동생이랑 엄마도 원해서 2개 더 구매했습니다:)",5
23.01.21.,모슈 오랫동안 고민하다가 마침 텀블러가 필요해서 700cc 크기로 구매했어용?? 생각보다 크고 무겁지만 많은 용량을 담을 수 있어서 만족하고 있어요ㅎㅎㅎ 색깔도 예쁘고 모양도 귀여워서 어딜 가나 주목받는 텀블러에요?????? 구매한거에 대해 후회없어용~ 잘 쓸게요!!,5
23.03.16.,안새서 진짜 조아요,5
23.01.27.,"재구매인데 리뉴얼은 처음 받아봐요
스트로우가 훨씸 매끈해지고 바닥고무도 넘 좋네요ㅜㅠ 전에꺼랑 비교되어요",5
23.01.19.,생일선물로 받고 처음 써봤는데 일단 너무 귀여워요! 아직 빨대는 안써봤는데 세척하기 편해서 좋은거같아요! 별다방 커피 그란데 사이즈까지 들어가는데 옵션으로 얼음 적게 선택해야 가능해요! 기름으로 스태인리스 부분 닦아봤는데 검은것도 거의 안나왔어용!,5
23.03.13.,써보고 좋아서 선물로 샀어용,5
23.02.15.,만족합니다 많이 파세요,4
23.02.21.,예쁘고 보냉도 좋고 빨대도 편해요,5
23.02.14.,너무 귀엽고 가벼워서 좋아유 고무패킹에 먼지가 많이 끼는 게 아쉽지만..,5
23.03.13.,이쁘고 좋아요 실용적,5
23.02.15.,색별로 크기별로 사고 싶어요 너무 좋아요,5
23.03.11.,"새지 않아서 좋네요 
부피에 비해 음료도 많이 들어가요",5
22.12.30.,"색은 정말 제가 원하던 색이 와서 기분이 좋았습니다. 심지어 기존빨대와 리뉴얼된 빨대, 2개를 주셔서 더 만족하였으나 사용했을경우 밀봉된 내용물은 새지 않으나 리드부분에 물이 고여있을경우 물이 새는 경우가 발생합니다. 아쉽네요...",3
23.03.15.,튼튼하고 좋아요 굿굿,5
23.03.09.,선물했는데 디자인 귀엽고 좋습니다,5
23.02.12.,"빨대가 실리콘이라 곧지 않은 건 아쉽지만
휴대하기 좋아요",5
23.03.11.,스무디도 장시간 동안 유지되용 짱짱,5
23.03.13.,모든면이 다 맘에 들엉노,5
23.02.16.,친구 선물로 줬는데 넘 이뻐요,5
23.03.05.,너무너무 이뻐요 선물로 줬는데 너무 좋아하네여,5
23.01.27.,넘넘... 귀여워요 귀여운데 심플한 텀블러 찾고 있었는데 너무 잘 산 것 같아요 하얀색과 파란색 조합은 실패하지 않는다...,5
23.03.05.,친구 생일선물로 줬는데 너무 좋아하네요!,5
23.01.26.,480이랑 700을 구매했는데 생각보다 480이 아담합니다! 너모 기여워요...색깔도 화면이랑 똑같구 아기자기합니다???? 몇 개월 괜히 고민했다 싶을 정도로 추천합니댜????,5
23.02.05.,다른색상도 사고 싶네요. 제가 써본 텀블러중에 제일 좋아요!,5
23.03.03.,보자마자 구매했는데 받아보아도 넘넘 이쁘네요,5
23.02.24.,선물했어요 -!!!,5
23.02.07.,모슈 텀블러 사용중인데 입구가 작아 넓은거 없나 하고 보니 스트로우 텀블러가 이번에 나와서 구매해봤는데 보냉도 잘되고 텀블러를 뒤집어봐도 새어나오지않아 좋은거같아요!!너무 만족합니다.,5
23.03.10.,가볍고 밀폐가 정말 잘 되요!,5
23.02.12.,선물로 샀는데 친구가 너무 좋아했어요!,5
23.02.11.,진짜 실용적이고 디자인 너무 예뻐요,5
23.02.14.,가지고다니기 너무 편해요!,5
23.01.16.,"귀여워요. 색상도 귀엽고 디자인도요. 제가 가지고 있는 비슷한 용량 제품보다 훨씬 작아보여서 이상하다 싶었는데, 물을 채워서 부어보니 비슷한 크기가 맞네요. 신기하게 작아 보입니다. 그래서 들고 다니기도 더 편할 것 같아요.",5
23.02.26.,디자인이 예쁘고 특히 스트로우를 말아서 가지고 다닐 수 있어 좋네요,5
23.01.27.,"디자인이 너무 예쁩니다
스텐이라 안심이고 세척도 간편합니다
빨대가 기본인걸 몰라 추가 구매했는데
빨대는 전혀 안쓰게 되네요",5
23.01.29.,"디자인이 너무 귀여워요 !???♀?
전 흰색 샀는데 낡거나 고장나면 노랑으로 재 구매 할려고요 ㅎㅎ 같이온 빨대는 고무라 먼지가 너무 잘붙어 사용 안하고 있지만 이 텀블러에 포인트는 빨대가 아닌가 싶습니다 ㅎㅎ??
일하는곳에는 먼지가 너무 잘 붙어 가급적이면 
빨대는 집에서만 쓰고있어용 
하지만 귀여우니 그건 문제 없어요 ??",5
23.02.03.,잘 쓰고 있어요!!! 보냉 보온도 잘되고 디자인도 예뻐서 잘 들고 다닙니다 ㅎㅎㅎ,5
23.02.08.,480 샀다가 느~~~무 맘에 들어서 큰거로 재구매 했습니다!!!,5
23.01.31.,항상 이 텀블러만 사용하고 있어요! 너무 좋아서 하나 더 샀습니다~,5
23.02.13.,너무너무 맘에들어요~,5
23.02.07.,친구 생일 선물로 샀는데 너무 좋아했어요~!,5
23.01.11.,"용량이 500정도되면 디자인들이 너무 투박해서 
맘에 드는 텀블러를 못찾고있었어요
용량도 디자인도 포기 못하다가 모슈 텀블러 발견했는데 정말 너무 예뻐요!! 
화이트와 아이보리 고민하다 아이보리 선택했는데 따뜻한 느낌의 노란색이라 참 예쁘네요.",5
23.02.09.,디자인도 예쁘고 보냉도 잘돼요,4
23.02.27.,선물해주려고 샀는데 기능이좋아용,5
23.02.09.,세척도 편하고 좋아요,4
23.03.03.,너무너무 이뻐서 다른것도.사야것어요,5
23.01.19.,700ml 펀딩으로 사서 몇달째 쓰고 있는데 너무 좋아서 스토어에서 추가구입했어요 아이보리 컬러가 슈크림같아서 넘나 예쁘네요,5
23.02.05.,잘 사용하고 잇어요! 가벼워서 이것만 써요 ㅎㅎ,5
23.02.01.,밀폐력이 짱좋아요.서비스도친절,5
23.01.28.,색깔이 파스텔 톤이라 어떤 상황에서든 잘 어울릴 것 같고 디자인도 심플해서 더 예쁘네요,5
23.01.29.,원래도 사용중이었는데 추가로 또 샀어요 리뉴얼버젼이 더좋네요!,5
23.02.05.,빨대가 있어 깔끔하게 먹기 좋아요,5
23.01.19.,디자인 예쁜데다가 뚜껑 열면 손 넣고 설거지 할 수 있어서 편리하고 너무 좋아요~ 보온보냉 노말하게 잘되요!!,5
23.02.01.,용량보다 작아 보이는데 그렇지 않더라고요! 무엇보다 예뻐서 좋아요~!!!! 아직 안 써봐서 밀폐력이나 보온력은 잘 모르겠지만 다른 후기 보면 밀폐력은 좋다고 하더라고요. 저는 밀폐력을 중시하는 편이라 실제로 가지고 다닐 때도 만족할 것 같습니다.,5
23.01.16.,마감이 좋고 예뻐요 다만 액체가 조금들었을때 고개를 젖히고 먹을때마다 작은구멍 덮개?가 코끝에 닿아서 코에 묻어요  ㅠㅠ 저에게는 나름 단점..,4
